{"$defs":{"Admissibility":{"description":"How much weight a performer observation may carry (§51.3).","enum":["performer_report_only","verifier_observed","gate_produced"],"type":"string"},"Blocker":{"description":"§53.1.","properties":{"condition_ref":{"type":"string"},"id":{"type":"string"},"owner_ref":{"type":"string"},"reason":{"type":"string"},"required_to_unblock":{"type":"string"}},"required":["id","condition_ref","reason","owner_ref","required_to_unblock"],"type":"object"},"DecisionProposal":{"description":"§53.3.","properties":{"id":{"type":"string"},"proposed_adr_ref":{"default":"","description":"§53.3 — a decision proposal SHALL become a proposed ADR before it becomes\nnormative.","type":"string"},"statement":{"type":"string"},"treated_as_normative":{"default":false,"type":"boolean"}},"required":["id","statement"],"type":"object"},"Deviation":{"description":"§53.2.","properties":{"affected_contract_path":{"type":"string"},"id":{"type":"string"},"impact":{"description":"§53.2's impact block. Stated, because a deviation whose impact is unstated\ncannot be granted exception authority on any informed basis.","type":"string"},"proposed_change":{"type":"string"},"reason":{"type":"string"}},"required":["id","affected_contract_path","proposed_change","reason","impact"],"type":"object"},"DiscoveredGap":{"description":"§53.4.","properties":{"disposition":{"anyOf":[{"$ref":"#/$defs/GapDisposition"},{"type":"null"}],"default":null},"id":{"type":"string"},"repaired_in_place":{"default":false,"description":"Whether someone just fixed it in place. §53.4 forbids exactly this, so it\nhas to be expressible in order to be refusable.","type":"boolean"},"statement":{"type":"string"},"under_specified":{"default":"","description":"What under-specified the thing: contract, SAS, ADR, gate, or source.","type":"string"}},"required":["id","statement"],"type":"object"},"GapDisposition":{"description":"§53.4's dispositions for a discovered gap. Repair-in-place is absent.","enum":["clarification","amendment","adr","child_war","supersession"],"type":"string"},"PerformerClaim":{"description":"§51.1's performer claim. An assertion, not evidence (§51.3).","properties":{"id":{"type":"string"},"statement":{"type":"string"}},"required":["id","statement"],"type":"object"},"PerformerObservation":{"description":"§51.1's performer observation.","properties":{"admissibility":{"$ref":"#/$defs/Admissibility","default":"performer_report_only"},"evidence_ref":{"default":"","type":"string"},"id":{"type":"string"},"statement":{"type":"string"}},"required":["id","statement"],"type":"object"},"RequestedNextAction":{"description":"§51.2's five permitted requests. There is deliberately no `resolve`.","enum":["continue","verify","block","amend","cancel"],"type":"string"}},"$id":"oh.war/stage-submission/v1","$schema":"https://json-schema.org/draft/2020-12/schema","description":"§51.1's Stage Submission — §37.4's claim envelope, in execution form.","properties":{"artifact_refs":{"default":[],"items":{"type":"string"},"type":"array"},"attempt_id":{"type":"string"},"blockers":{"default":[],"items":{"$ref":"#/$defs/Blocker"},"type":"array"},"claims":{"default":[],"items":{"$ref":"#/$defs/PerformerClaim"},"type":"array"},"contract_digest":{"type":"string"},"decision_proposals":{"default":[],"items":{"$ref":"#/$defs/DecisionProposal"},"type":"array"},"deviation_proposals":{"default":[],"items":{"$ref":"#/$defs/Deviation"},"type":"array"},"discovered_gaps":{"default":[],"items":{"$ref":"#/$defs/DiscoveredGap"},"type":"array"},"dispatch_id":{"type":"string"},"performer_observations":{"default":[],"items":{"$ref":"#/$defs/PerformerObservation"},"type":"array"},"requested_next_action":{"anyOf":[{"$ref":"#/$defs/RequestedNextAction"},{"type":"null"}]},"stage_id":{"type":"string"},"unresolved_items":{"default":[],"items":{"type":"string"},"type":"array"}},"required":["dispatch_id","attempt_id","contract_digest","stage_id"],"title":"StageSubmission","type":"object"}
