{
  "dispatch_id": "01a0deff-4c7b-7571-b026-556037d55393",
  "attempt_id": "01a0deff-4c7b-7571-b026-555fa1172b73",
  "contract_digest": "56b6fff1456174d48be486e8f50a3f1de84b2878b35af0ac2af45e65f891aa51",
  "stage_id": "STAGE-003",
  "claims": [
    {
      "id": "C-001",
      "statement": "gate://ops.conformance.plants@1.1.0 ran under dispatch 01a0deff-4c7b-7571-b026-556037d55393 with verdict pass; the receipt is the evidence, this sentence is not"
    }
  ],
  "artifact_refs": [
    "docs/warrants/OW-WAR-0115/dispatches/01a0deff-4c7b-7571-b026-556037d55393.json"
  ],
  "performer_observations": [],
  "blockers": [],
  "deviation_proposals": [],
  "decision_proposals": [],
  "discovered_gaps": [],
  "unresolved_items": [],
  "requested_next_action": "verify"
}
